{
  "$schema": "./layers.schema.json",
  "schemaVersion": 1,
  "timeline": {
    "minYear": 2016
  },
  "groups": [
    { "id": "threats", "title": "Threats" },
    { "id": "interest", "title": "Interest" }
  ],
  "layers": [
    {
      "id": "all",
      "title": "All",
      "group": "threats",
      "status": "coming-soon",
      "display": {
        "buttonType": "big",
        "icon": "mdi-home-city",
        "color": "brown-lighten-1",
        "images": {
          "visible": "all_visible",
          "hidden": "all_notvisible"
        }
      },
      "tiles": {
        "type": "raster",
        "url": "https://stamen-tiles.a.ssl.fastly.net/watercolor/{z}/{x}/{y}.jpg"
      },
      "years": {
        "available": [2016, 2017, 2018, 2019, 2020, 2021, 2022]
      }
    },
    {
      "id": "built",
      "title": "Built",
      "group": "threats",
      "status": "published",
      "display": {
        "buttonType": "small",
        "icon": "mdi-office-building",
        "color": "#767676"
      },
      "tiles": {
        "type": "raster",
        "url": "https://storage.googleapis.com/nature-watch-tiles/built/2023/{z}/{x}/{y}.png"
      },
      "years": {
        "available": [2023],
        "meaning": "snapshot"
      },
      "source": {
        "name": "Google Open Buildings 2023 (confidence 0.80 or higher), with GHSL 2020 where Open Buildings has no coverage",
        "url": "https://sites.research.google/open-buildings/"
      },
      "info": {
        "content": "The map shows one built snapshot, for 2023. It uses <a href=\"https://sites.research.google/open-buildings/\" target=\"_blank\">Google Open Buildings (2023)</a> polygons with a confidence score of 0.80 or higher. Where that dataset has no coverage — Chad, Mali, Libya, Morocco and Western Morocco — it uses the <a href=\"https://ghsl.jrc.ec.europa.eu/ghs_buS2023.php\" target=\"_blank\">Global Human Settlement Layer</a> for 2020. A mark means the source recorded a building. It does not say how the building is used. Choosing another year on the timeline still shows this 2023 snapshot, because no other built year is published."
      }
    },
    {
      "id": "treeloss",
      "title": "Treeloss",
      "group": "threats",
      "status": "published",
      "display": {
        "buttonType": "small",
        "icon": "mdi-tree",
        "color": "#D487A4"
      },
      "tiles": {
        "type": "raster",
        "url": "https://tiles.globalforestwatch.org/umd_tree_cover_loss/v1.13/dynamic/{z}/{x}/{y}.png",
        "query": "?&start_year=2001&end_year={year}&render_type=true_color"
      },
      "years": {
        "available": [
          2016, 2017, 2018, 2019, 2020, 2021, 2022, 2023, 2024, 2025
        ],
        "meaning": "cumulative",
        "since": 2001
      },
      "source": {
        "name": "UMD GLAD tree cover loss via Global Forest Watch",
        "version": "v1.13",
        "url": "https://www.globalforestwatch.org/"
      },
      "info": {
        "content": "Tree cover loss from 2001 through the selected year, from University of Maryland GLAD version 1.13, drawn from <a href=\"https://www.globalforestwatch.org/\" target=\"_blank\">Global Forest Watch</a> tiles. Loss means the dataset recorded a stand-replacing disturbance, which includes fire and forestry as well as clearing. It is not a measure of deforestation by itself. Version 1.13 adds 2025 and also revises earlier years, so a past year can look different from an older copy of this map. This app does not set a tree-cover density cutoff in the tile request."
      }
    },
    {
      "id": "fire",
      "title": "Fire",
      "group": "threats",
      "status": "published",
      "display": {
        "buttonType": "small",
        "icon": "mdi-fire",
        "color": "#f8674a"
      },
      "tiles": {
        "type": "raster",
        "url": "https://storage.googleapis.com/nature-watch-tiles/fire/",
        "query": "{year}/{z}/{x}/{y}.png",
        "maxzoom": 9,
        "resampling": "nearest"
      },
      "years": {
        "available": [
          2016, 2017, 2018, 2019, 2020, 2021, 2022, 2023, 2024, 2025
        ],
        "meaning": "annual"
      },
      "source": {
        "name": "NASA FIRMS active fire detections, counted in 14-day intervals per year",
        "url": "https://firms.modaps.eosdis.nasa.gov/map/"
      },
      "info": {
        "content": "Each coloured square is a count of <a href=\"https://firms.modaps.eosdis.nasa.gov/map/\" target=\"_blank\">NASA FIRMS</a> detections, not a judgement about why a place burned. The year is split into 14-day windows. A square’s number is how many of those windows contained a detection. The count can reach 27: there are 27 windows, and the last one runs about 13 days into January of the next year. Squares are about 1 km across. Empty squares had no detection in those windows.\n    <ul>\n    <li>Light yellow: 1 window</li>\n    <li>Orange: 2 or 3 windows</li>\n    <li>Red: 4 to 8 windows</li>\n    <li>Dark red: 9 or more windows</li>\n</ul>\n    Colour does not identify agriculture, mining, or a natural fire. Coverage is the Africa export blocks, including some ocean.",
        "image": "fire_legend"
      }
    },
    {
      "id": "bare",
      "title": "Bare",
      "group": "threats",
      "status": "coming-soon",
      "display": {
        "buttonType": "small",
        "icon": "mdi-square-rounded",
        "color": "red-lighten-3"
      },
      "tiles": {
        "type": "raster",
        "url": "https://storage.googleapis.com/nature-watch-tiles/built/2022/{z}/{x}/{y}.png"
      },
      "years": {
        "available": [2016, 2017, 2018, 2019, 2020, 2021, 2022]
      }
    },
    {
      "id": "mines",
      "title": "Mines",
      "group": "threats",
      "status": "coming-soon",
      "display": {
        "buttonType": "small",
        "icon": "mdi-shovel",
        "color": "amber-lighten-4"
      },
      "tiles": {
        "type": "raster",
        "url": "https://stamen-tiles.a.ssl.fastly.net/watercolor/{z}/{x}/{y}.jpg"
      },
      "years": {
        "available": [2016, 2017, 2018, 2019, 2020, 2021, 2022]
      }
    },
    {
      "id": "crops",
      "title": "Crops",
      "group": "threats",
      "status": "published",
      "display": {
        "buttonType": "small",
        "icon": "mdi-barley",
        "color": "#e59139"
      },
      "tiles": {
        "type": "raster",
        "url": "https://storage.googleapis.com/nature-watch-tiles/crop/",
        "query": "{year}/{z}/{x}/{y}.png"
      },
      "years": {
        "available": [2015, 2019],
        "meaning": "snapshot"
      },
      "source": {
        "name": "UMD GLAD Global Cropland Expansion in the 21st Century",
        "url": "https://glad.umd.edu/dataset/croplands"
      },
      "info": {
        "content": "Cropland from the <a href=\"https://glad.umd.edu/dataset/croplands\" target=\"_blank\">UMD GLAD Global Cropland Expansion</a> dataset. The map publishes two snapshots, 2015 and 2019. For any timeline year after 2019, the crops layer still shows 2019. A coloured area means the dataset classed that place as cropland in the snapshot year. It does not show crop type or yield."
      }
    },
    {
      "id": "rivers",
      "title": "Rivers",
      "group": "threats",
      "status": "coming-soon",
      "display": {
        "buttonType": "big",
        "icon": "mdi-water",
        "color": "brown-lighten-1",
        "images": {
          "visible": "rivers_visible",
          "hidden": "rivers_notvisible"
        }
      },
      "tiles": {
        "type": "raster",
        "url": "https://stamen-tiles.a.ssl.fastly.net/watercolor/{z}/{x}/{y}.jpg"
      },
      "years": {
        "available": [2016, 2017, 2018, 2019, 2020, 2021, 2022]
      }
    },
    {
      "id": "dams",
      "title": "Dams",
      "group": "threats",
      "status": "published",
      "display": {
        "buttonType": "small",
        "icon": "mdi-bridge",
        "color": "#80a1a8"
      },
      "tiles": {
        "type": "circle",
        "url": "mapbox://nature-watch.dam-test-tiles",
        "sourceLayer": "dams",
        "circle": {
          "radius": 4,
          "colorSatellite": "#b7e6f1",
          "colorStreets": "#5b7378"
        }
      },
      "years": {
        "available": [2016, 2017, 2018, 2019, 2020, 2021, 2022],
        "meaning": "static"
      },
      "info": {
        "subtitle": "Same points every year",
        "content": "The same dam points are drawn for every year from 2016 through 2022. Moving the timeline does not change them. This catalog does not name the source dataset."
      }
    },
    {
      "id": "tree-height",
      "title": "Tree height",
      "group": "interest",
      "status": "published",
      "display": {
        "buttonType": "small",
        "icon": "mdi-tree",
        "color": "#1a751a",
        "tooltip": "2020"
      },
      "tiles": {
        "type": "raster",
        "url": "https://tiles.globalforestwatch.org/umd_tree_cover_height_2020/v2022/tch_3/{z}/{x}/{y}.png"
      },
      "years": {
        "available": [2020],
        "meaning": "static"
      },
      "source": {
        "name": "UMD GLAD tree cover height 2020 via Global Forest Watch",
        "version": "v2022",
        "url": "https://doi.org/10.1016/j.rse.2020.112165"
      },
      "info": {